{"kind":"wet_rates","unit":"player_week","provenance":"synthetic_fixture","source":"SYNTHETIC - data/fixtures/nflverse_sample/player_week_rates.csv, hand-made; no nflverse data was fetched","policy":"R94 MEASURE ONLY. Play-level numerators and denominators for the weather measurement: the unit of analysis is an attempt or a target, never a game. Nothing that ships reads this document - no projection, no rating, no leg pool - and no market number appears in it. A row stamped provenance=synthetic_fixture is a placeholder: available() refuses it and no measurement may be taken on it.","generated_utc":"2026-09-20T00:00:00Z","seasons_requested":[2098,2099],"seasons_fetched":[2098,2099],"seasons_unavailable":{},"required_columns":["attempts","carries","completions","name","opp","passing_interceptions","passing_yards","pid","pos","receiving_air_yards","receiving_fumbles","receiving_fumbles_lost","receiving_yards","receptions","rushing_fumbles","rushing_fumbles_lost","sack_fumbles","sack_fumbles_lost","sacks","season","season_type","targets","team","week"],"rows":{"2098":{"1|AAA|00-0000001":{"name":"Rain Arm","pos":"QB","team":"AAA","opp":"BBB","week":1,"completions":5,"attempts":9,"passing_yards":60.0,"passing_interceptions":0,"sacks":0,"carries":0,"targets":0,"receptions":0,"receiving_yards":0.0,"receiving_air_yards":0.0,"sack_fumbles":0,"sack_fumbles_lost":0,"rushing_fumbles":0,"rushing_fumbles_lost":0,"receiving_fumbles":0,"receiving_fumbles_lost":0}},"2099":{"1|AAA|00-0000001":{"name":"Rain Arm","pos":"QB","team":"AAA","opp":"BBB","week":1,"completions":20,"attempts":32,"passing_yards":210.0,"passing_interceptions":2,"sacks":3,"carries":2,"targets":0,"receptions":0,"receiving_yards":0.0,"receiving_air_yards":0.0,"sack_fumbles":1,"sack_fumbles_lost":1,"rushing_fumbles":0,"rushing_fumbles_lost":0,"receiving_fumbles":0,"receiving_fumbles_lost":0},"1|AAA|00-0000002":{"name":"Slick Hands","pos":"WR","team":"AAA","opp":"BBB","week":1,"completions":1,"attempts":1,"passing_yards":25.0,"passing_interceptions":0,"sacks":0,"carries":1,"targets":10,"receptions":6,"receiving_yards":70.0,"receiving_air_yards":95.0,"sack_fumbles":0,"sack_fumbles_lost":0,"rushing_fumbles":0,"rushing_fumbles_lost":0,"receiving_fumbles":1,"receiving_fumbles_lost":0},"1|AAA|00-0000003":{"name":"Tight Grip","pos":"TE","team":"AAA","opp":"BBB","week":1,"completions":0,"attempts":0,"passing_yards":0.0,"passing_interceptions":0,"sacks":0,"carries":0,"targets":5,"receptions":4,"receiving_yards":41.0,"receiving_air_yards":30.0,"sack_fumbles":0,"sack_fumbles_lost":0,"rushing_fumbles":0,"rushing_fumbles_lost":0,"receiving_fumbles":0,"receiving_fumbles_lost":0},"1|AAA|00-0000004":{"name":"Mud Runner","pos":"RB","team":"AAA","opp":"BBB","week":1,"completions":0,"attempts":0,"passing_yards":0.0,"passing_interceptions":0,"sacks":0,"carries":18,"targets":3,"receptions":2,"receiving_yards":12.0,"receiving_air_yards":4.0,"sack_fumbles":0,"sack_fumbles_lost":0,"rushing_fumbles":1,"rushing_fumbles_lost":0,"receiving_fumbles":0,"receiving_fumbles_lost":0},"1|BBB|00-0000005":{"name":"Dry Arm","pos":"QB","team":"BBB","opp":"AAA","week":1,"completions":25,"attempts":30,"passing_yards":300.0,"passing_interceptions":0,"sacks":1,"carries":1,"targets":0,"receptions":0,"receiving_yards":0.0,"receiving_air_yards":0.0,"sack_fumbles":0,"sack_fumbles_lost":0,"rushing_fumbles":0,"rushing_fumbles_lost":0,"receiving_fumbles":0,"receiving_fumbles_lost":0},"1|BBB|00-0000006":{"name":"Sure Hands","pos":"WR","team":"BBB","opp":"AAA","week":1,"completions":0,"attempts":0,"passing_yards":0.0,"passing_interceptions":0,"sacks":0,"carries":0,"targets":12,"receptions":9,"receiving_yards":140.0,"receiving_air_yards":120.0,"sack_fumbles":0,"sack_fumbles_lost":0,"rushing_fumbles":0,"rushing_fumbles_lost":0,"receiving_fumbles":0,"receiving_fumbles_lost":0},"2|AAA|00-0000001":{"name":"Rain Arm","pos":"QB","team":"AAA","opp":"CCC","week":2,"completions":15,"attempts":25,"passing_yards":180.0,"passing_interceptions":1,"sacks":2,"carries":3,"targets":0,"receptions":0,"receiving_yards":0.0,"receiving_air_yards":0.0,"sack_fumbles":0,"sack_fumbles_lost":0,"rushing_fumbles":1,"rushing_fumbles_lost":1,"receiving_fumbles":0,"receiving_fumbles_lost":0},"2|BBB|00-0000007":{"name":"Blank Line","pos":"WR","team":"BBB","opp":"AAA","week":2,"completions":0,"attempts":0,"passing_yards":0.0,"passing_interceptions":0,"sacks":0,"carries":0,"targets":4,"receptions":3,"receiving_yards":33.0,"receiving_air_yards":28.0,"sack_fumbles":0,"sack_fumbles_lost":0,"rushing_fumbles":0,"rushing_fumbles_lost":0,"receiving_fumbles":0,"receiving_fumbles_lost":0},"2|LV|00-0000008":{"name":"Old Raider","pos":"RB","team":"LV","opp":"AAA","week":2,"completions":0,"attempts":0,"passing_yards":0.0,"passing_interceptions":0,"sacks":0,"carries":10,"targets":2,"receptions":1,"receiving_yards":9.0,"receiving_air_yards":3.0,"sack_fumbles":0,"sack_fumbles_lost":0,"rushing_fumbles":0,"rushing_fumbles_lost":0,"receiving_fumbles":0,"receiving_fumbles_lost":0}}}}